Country,Project,Main_fuel,Other_fuels,Location,Status,Capacity,Began_operations,Owner,Capital,CompanyHQ,Shareholders,Notes,Links,Latitude,Longitude,capacity_old,Fuel_test
Brasil,Maranhão III,Gas natural,,Santo Antônio dos Lopes - MA,Activa,519,1/7/16,Parnaíba Ii Geração De Energia S.A,Privado,Rio de Janeiro,Parnaíba Ii Geração De Energia S.A,werid coordinates,,-4.491951,-44.211695,519,Gas
Brasil,Do Atlântico,Petróleo,,Rio de Janeiro - RJ,Activa,490,1/1/11,Ternium Brasil Ltda.,Privado,Rio de Janeiro,Ternium Brasil Ltda.,werid coordinates,,-22.543546,-43.442275,490,Otro
Brasil,Araucária,Gas natural,,Araucária - PR,Activa,484,27/09/2002,U.E.G. Araucária Ltda.,Mixto,Araucária,U.E.G. Araucária Ltda.,werid coordinates,,-25.3518,-49.2121,484,Gas
Brasil,Mauá,Fuel oil,,Manaus - AM,Activa,463,1/7/73,Amazonas Geração E Transmissão De Energia S.A,Privado,Cachoeirinha,Amazonas Geração E Transmissão De Energia S.A,werid coordinates,,-3.73984,-59.554874,463,Fuel oil
Brasil,Termo Norte II,Gas natural,,Porto Velho - RO,Activa,427,1/12/01,Termo Norte Energia Ltda.,Privado,Porto Velho,Termo Norte Energia Ltda.,werid coordinates,,-8.468011,-63.495321,427,Gas
Brasil,Piratininga,Fuel oil,,São Paulo - SP,Activa,390,1/1/54,Baixada Santista Energia S.A.,Mixto,Cubatão,Baixada Santista Energia S.A.,werid coordinates,,-23.421001,-46.4041,390,Fuel oil
Brasil,Nova Piratininga (Antiga Fernando Gasparian),Gas natural,,São Paulo - SP,Activa,386,31/12/2004,Petróleo Brasileiro S A Petrobras,Mixto,Rio de Janeiro,Petróleo Brasileiro S A Petrobras,werid coordinates,,-23.4156,-46.4043,386,Gas
Brasil,Seropédica (Antiga Barbosa Lima Sobrinho),Gas natural,,Seropédica - RJ,Activa,386,1/10/01,Petróleo Brasileiro S A Petrobras,Mixto,Rio de Janeiro,Petróleo Brasileiro S A Petrobras,werid coordinates,,-22.431216,-43.384863,386,Gas
Brasil,Três Lagoas (Antiga Luiz Carlos Prestes),Gas natural,,Três Lagoas - MS,Activa,386,8/1/04,Petróleo Brasileiro S A Petrobras,Mixto,Rio de Janeiro,Petróleo Brasileiro S A Petrobras,werid coordinates,,-20.4442,-51.3949,386,Gas
Brasil,Suape II,Fuel oil,,Cabo de Santo Agostinho - PE,Activa,381,24/01/2013,Energética Suape Ii S.A.,Privado,Suape,Energética Suape Ii S.A.,werid coordinates,,-8.172351,-35.21856,381,Fuel oil
Brasil,Porto do Pecém II,Carbón,,São Gonçalo do Amarante - CE,Activa,365,18/10/2013,Pecém Ii Geração De Energia S.A.,Mixto,São Gonçalo do Amarante,Pecém Ii Geração De Energia S.A.,werid coordinates,,-3.5495406,-38.8130235,365,Carbón
Brasil,Jorge Lacerda IV,Carbón,,Capivari de Baixo - SC,Activa,363,1/2/97,Diamante Geração De Energia Ltda.,Privado,Florianópolis,Diamante Geração De Energia Ltda.,werid coordinates,,-28.265657,-48.573807,363,Carbón
Brasil,Porto do Itaqui (Antiga Termomaranhão),Carbón,,São Luís - MA,Activa,360,5/2/13,Itaqui Geração De Energia S/A,Privado,São Luis,Itaqui Geração De Energia S/A,werid coordinates,,-2.3143,-44.182,360,Carbón
Brasil,Candiota III,Carbón,,Candiota - RS,Activa,350,1/1/11,Companhia De Geração E Transmissão De Energia Elétrica Do Sul Do Brasil - Eletrobras Cgt Eletrosul,Mixto,Florianópolis,Companhia De Geração E Transmissão De Energia Elétrica Do Sul Do Brasil - Eletrobras Cgt Eletrosul,werid coordinates,,-31.33,-53.4,350,Carbón
Brasil,Pampa Sul,Carbón,,Candiota - RS,Activa,345,28/6/2019,Usina Termelétrica Pampa Sul S.A.,Privado,Florianópolis,Usina Termelétrica Pampa Sul S.A.,werid coordinates,,-31.273334,-53.464447,345,Carbón
Brasil,Maranhão IV (Antiga MC2 Joinville),Gas natural,,Santo Antônio dos Lopes - MA,Activa,338,1/2/13,Parnaíba Geração E Comercialização De Energia S.A,Privado,Rio de Janeiro,Parnaíba Geração E Comercialização De Energia S.A,werid coordinates,,-26.172943,-48.531678,338,Gas
Brasil,Maranhão V (Antiga MC2 João Neiva),Gas natural,,Santo Antônio dos Lopes - MA,Activa,338,29/03/2013,Parnaíba Geração E Comercialização De Energia S.A,Privado,Rio de Janeiro,Parnaíba Geração E Comercialização De Energia S.A,werid coordinates,,-19.45288,-40.2396,338,Gas
Brasil,Fortaleza,Gas natural,,Caucaia - CE,Activa,327,27/12/2003,Central Geradora Termeletrica Fortaleza S.A.,Privado,Fortaleza,Central Geradora Termeletrica Fortaleza S.A.,werid coordinates,,-3.6813963,-38.9002151,327,Gas
Brasil,Vale do Açú (Antiga Jesus Soares Pereira),Gas natural,,Alto do Rodrigues - RN,Activa,323,10/9/08,Petróleo Brasileiro S A Petrobras,Mixto,Rio de Janeiro,Petróleo Brasileiro S A Petrobras,werid coordinates,,-5.2257,-36.497,323,Gas
Brasil,MC2 Nova Venécia 2,Gas natural,,Santo Antônio dos Lopes - MA,Activa,270,23/10/2013,Parnaíba Ii Geração De Energia S.A,Privado,Rio de Janeiro,Parnaíba Ii Geração De Energia S.A,werid coordinates,,-4.528523,-44.213608,270,Gas
Brasil,Jorge Lacerda III,Carbón,,Capivari de Baixo - SC,Activa,262,1/2/79,Diamante Geração De Energia Ltda.,Privado,Florianópolis,Diamante Geração De Energia Ltda.,werid coordinates,,-28.265657,-48.573807,262,Carbón
Brasil,Cubatão (Euzébio Rocha),Gas natural,,Cubatão - SP,Activa,250,17/11/2009,Petróleo Brasileiro S A Petrobras,Mixto,Rio de Janeiro,Petróleo Brasileiro S A Petrobras,werid coordinates,,-23.523199,-46.255461,250,Gas
Brasil,Canoas (Antiga Sepé Tiaraju),Gas natural,,Canoas - RS,Activa,249,29/03/2001,Petróleo Brasileiro S A Petrobras,Mixto,Rio de Janeiro,Petróleo Brasileiro S A Petrobras,werid coordinates,,-29.5235,-51.849,249,Gas
Brasil,Aparecida Parte I,Gas natural,,Manaus - AM,Activa,241,1/8/97,Amazonas Geração E Transmissão De Energia S.A,Privado,Cachoeirinha,Amazonas Geração E Transmissão De Energia S.A,werid coordinates,,-3.746999,-60.158001,241,Gas
Brasil,Jorge Lacerda I e II,Carbón,,Capivari de Baixo - SC,Activa,232,1/3/65,Diamante Geração De Energia Ltda.,Privado,Florianópolis,Diamante Geração De Energia Ltda.,werid coordinates,,-28.265657,-48.573807,232,Carbón
Brasil,Ibirité (Aureliano Chaves),Gas natural,,Ibirité - MG,Activa,226,8/7/02,Petróleo Brasileiro S A Petrobras,Mixto,Rio de Janeiro,Petróleo Brasileiro S A Petrobras,werid coordinates,,-19.5926,-44.553999,226,Gas
Brasil,CST,Petróleo,,Serra - ES,Activa,225,1/4/03,Arcelormittal Brasil S.A.,Privado,Belo Horizonte,Arcelormittal Brasil S.A.,werid coordinates,,-20.7444,-40.18288,225,Otro
Brasil,Termoceará,Gas natural,,Caucaia - CE,Activa,220,6/7/02,Petróleo Brasileiro S A Petrobras,Mixto,Rio de Janeiro,Petróleo Brasileiro S A Petrobras,werid coordinates,,-3.6920385,-38.8732557,220,Gas
Brasil,CSP,Otro,,São Gonçalo do Amarante - CE,Activa,218,14/10/2016,Companhia Siderurgica Do Pecem,Privado,São Gonçalo do Amarante,Companhia Siderurgica Do Pecem,werid coordinates,,-3.5495406,-38.8130235,218,Gas
Brasil,Luiz Oscar Rodrigues de Melo (Antiga Linhares),Gas natural,,Linhares - ES,Activa,204,23/12/2010,Linhares Geração S.A.,Privado,Linhares,Linhares Geração S.A.,werid coordinates,,-19.5339665,-39.8029832,204,Gas
Brasil,Pernambuco III,Fuel oil,,Igarassu - PE,Activa,201,5/12/13,Termelétrica Pernambuco Iii S.A,Privado,Igarassu,Termelétrica Pernambuco Iii S.A,werid coordinates,,-7.5145,-35.13,201,Fuel oil
Brasil,Termobahia (Antiga Celso Furtado),Gas natural,,São Francisco do Conde - BA,Activa,186,9/2/04,Petróleo Brasileiro S A Petrobras,Mixto,Rio de Janeiro,Petróleo Brasileiro S A Petrobras,werid coordinates,,-12.4228,-38.3435,186,Gas
Brasil,CTE II,Gas natural,,Volta Redonda - RJ,Activa,178,1/4/03,Companhia Siderúrgica Nacional,Privado,São Paulo,Companhia Siderúrgica Nacional,werid coordinates,,-22.31228,-44.6144,178,Gas
Brasil,Palmeiras de Goiás,Diesel,,Palmeiras de Goiás - GO,Activa,176,17/07/2012,Central Energética Palmeiras S.A,Privado,Palmeiras de Goiás,Central Energética Palmeiras S.A,werid coordinates,,-16.4836,-49.5528,176,Diesel
Brasil,Viana,Fuel oil,,Viana - ES,Activa,175,6/1/10,Termelétrica Viana S.A.,Privado,Rio de Janeiro,Termelétrica Viana S.A.,werid coordinates,,-20.224062,-40.621949,175,Fuel oil
Brasil,Termonordeste,Fuel oil,,João Pessoa - PB,Activa,171,24/12/2010,Centrais Elétricas Da Paraíba S.A.,Privado,João Pessoa,Centrais Elétricas Da Paraíba S.A.,werid coordinates,,-6.1346,-36.123,171,Fuel oil
Brasil,Termoparaíba,Fuel oil,,João Pessoa - PB,Activa,171,13/01/2011,Centrais Elétricas Da Paraíba S.A.,Privado,João Pessoa,Centrais Elétricas Da Paraíba S.A.,werid coordinates,,-7.21049,-34.9232955,171,Fuel oil
Brasil,Campina Grande,Fuel oil,,Campina Grande - PB,Activa,169,8/2/11,Borborema Energética S.A.,Privado,Campina Grande,Borborema Energética S.A.,werid coordinates,,-7.145,-35.5358,169,Fuel oil
Brasil,Maracanaú I,Fuel oil,,Maracanaú - CE,Activa,168,30/12/2010,Maracanaú Geradora De Energia S.A.,Privado,Fortaleza,Maracanaú Geradora De Energia S.A.,werid coordinates,,-3.8503708,-38.5580521,168,Fuel oil
Brasil,Geramar I (Antiga Tocantinópolis),Fuel oil,,Miranda do Norte - MA,Activa,166,9/1/10,Gera Maranhão - Geradora De Energia Do Maranhão S.A.,Privado,São Luis,Gera Maranhão - Geradora De Energia Do Maranhão S.A.,werid coordinates,,-3.3358225,-44.33313,166,Fuel oil
Brasil,Geramar II (Antiga Nova Olinda),Fuel oil,,Miranda do Norte - MA,Activa,166,6/2/10,Gera Maranhão - Geradora De Energia Do Maranhão S.A.,Privado,São Luis,Gera Maranhão - Geradora De Energia Do Maranhão S.A.,werid coordinates,,-3.3358203,-44.333126,166,Fuel oil
Brasil,Monte Cristo,Diesel,,Boa Vista - RR,Activa,155,29/07/2015,Roraima Energia S.A,Privado,Boa Vista,Roraima Energia S.A,werid coordinates,,-2.554984N,-60.425283,155,Diesel
Brasil,Arembepe (Antiga Camaçari Pólo de Apoio I),Fuel oil,,Camaçari - BA,Activa,150,30/06/2010,Petróleo Brasileiro S A Petrobras,Mixto,Rio de Janeiro,Petróleo Brasileiro S A Petrobras,werid coordinates,,-12.4125,-38.187,150,Fuel oil
Brasil,U-50,Fuel oil,,Ipojuca - PE,Activa,150,27/10/2015,Petróleo Brasileiro S A Petrobras,Mixto,Rio de Janeiro,Petróleo Brasileiro S A Petrobras,werid coordinates,,-8.23941,-35.148014,150,Fuel oil
Brasil,Global I,Fuel oil,,Candeias - BA,Activa,149,7/5/10,Companhia Energética Candeias,Privado,Salvador,Companhia Energética Candeias,werid coordinates,,-12.434881,-38.285252,149,Fuel oil
Brasil,Global II,Fuel oil,,Candeias - BA,Activa,149,20/05/2010,Companhia Energética Candeias,Privado,Salvador,Companhia Energética Candeias,werid coordinates,,-12.434806,-38.285556,149,Fuel oil
Brasil,Sol,Otro,,Serra - ES,Activa,147,19/06/2007,Arcelormittal Brasil S.A.,Privado,Belo Horizonte,Arcelormittal Brasil S.A.,werid coordinates,,-20.742816,-40.184104,147,Otro
Brasil,Muricy (Antiga Camaçari Muricy I),Fuel oil,,Camaçari - BA,Activa,147,30/09/2009,Petróleo Brasileiro S A Petrobras,Mixto,Rio de Janeiro,Petróleo Brasileiro S A Petrobras,werid coordinates,,-12.415574,-38.193266,147,Fuel oil
Brasil,Termomanaus,Diesel,,Igarassu - PE,Activa,143,18/06/2009,Centrais Elétricas De Pernambuco S.A.,Privado,Igarassu,Centrais Elétricas De Pernambuco S.A.,werid coordinates,,-7.51388,-35.178,143,Diesel
Brasil,Goiânia II,Diesel,,Aparecida de Goiânia - GO,Activa,140,17/01/2009,Brentech Energia S.A,Privado,Aparecida de Goiânia,Brentech Energia S.A,werid coordinates,,-16.4738,-49.1422,140,Diesel
Brasil,Celpav IV,Gas natural,,Jacareí - SP,Activa,139,1/8/03,Suzano S.A.,Privado,São Paulo,Suzano S.A.,werid coordinates,,-23.175597,-45.592584,139,Gas
Brasil,Cogeração International Paper - Fases I e II,Fuel oil,,Mogi Guaçu - SP,Activa,138,1/8/76,International Paper Do Brasil Ltda.,Privado,São Paulo,International Paper Do Brasil Ltda.,werid coordinates,,-22.2137,-46.5812,138,Fuel oil
Brasil,Petrolina,Diesel,,Petrolina - PE,Activa,136,3/10/02,Companhia Energética De Petrolina,Privado,Petrolina,Companhia Energética De Petrolina,werid coordinates,,-9.2350554,-40.296,136,Diesel
Brasil,Igarapé,Fuel oil,,Juatuba - MG,Activa,131,1/1/63,Cemig Geração E Transmissão S.A,Mixto,Belo Horizonte,Cemig Geração E Transmissão S.A,werid coordinates,,-19.5772,-44.20348,131,Fuel oil
Brasil,Camaçari,Gas natural,,Camaçari - BA,Activa,131,1/1/96,Braskem S/A,Privado,São Paulo,Braskem S/A,werid coordinates,,-12.41528,-38.19264,131,Gas
Brasil,Termocamaçari (Antiga Rômulo Almeida Unidade I),Gas natural,,Camaçari - BA,Activa,120,13/10/2003,Petróleo Brasileiro S A Petrobras,Mixto,Rio de Janeiro,Petróleo Brasileiro S A Petrobras,werid coordinates,,-12.415574,-38.193266,120,Gas
Brasil,Refinaria de Paulínea - REPLAN,Otro,,Paulínia - SP,Activa,107,1/1/76,Petróleo Brasileiro S A Petrobras,Mixto,Rio de Janeiro,Petróleo Brasileiro S A Petrobras,werid coordinates,,-22.4343,-47.741999,107,Gas
Brasil,Alunorte,Carbón,,Barcarena - PA,Activa,104,26/09/2007,Alumina Do Norte Do Brasil S/A,Privado,Barcarena,Alumina Do Norte Do Brasil S/A,werid coordinates,,-1.3229,-48.4357,104,Carbón
Brasil,Açominas,Otro,,Ouro Branco - MG,Activa,103,1/8/02,Gerdau Açominas S/A,Privado,Porto Alegre,Gerdau Açominas S/A,werid coordinates,,-20.312878,-43.403122,103,Gas
Brasil,Flores,Diesel,,Manaus - AM,Activa,95,26/09/2008,Amazonas Geração E Transmissão De Energia S.A,Privado,Cachoeirinha,Amazonas Geração E Transmissão De Energia S.A,werid coordinates,,-3.43733,-60.1281,95,Diesel
Brasil,Unidade de Tratamento de Gás Monteiro Lobato (UTGCA),Gas natural,,Caraguatatuba - SP,Activa,95,16/5/2011,Petróleo Brasileiro S A Petrobras,Mixto,Rio de Janeiro,Petróleo Brasileiro S A Petrobras,werid coordinates,,-23.3992,-45.29578,95,Gas
Brasil,Pau Ferro I,Diesel,,Igarassu - PE,Activa,94,18/06/2009,Centrais Elétricas De Pernambuco S.A.,Privado,Recife,Centrais Elétricas De Pernambuco S.A.,werid coordinates,,-7.51388,-35.178,94,Diesel
Brasil,Tambaqui,Fuel oil,,Manaus - AM,Activa,93,12/1/06,Breitener Tambaqui S.A,Mixto,Manaus,Breitener Tambaqui S.A,werid coordinates,,-3.67,-60.13,93,Fuel oil
Brasil,Juiz de Fora,Gas natural,,Juiz de Fora - MG,Activa,87,1/2/02,Petróleo Brasileiro S A Petrobras,Mixto,Rio de Janeiro,Petróleo Brasileiro S A Petrobras,werid coordinates,,-21.4122,-43.2725,87,Gas
Brasil,Senador Arnon Afonso Farias de Mello - Floresta,Diesel,,Boa Vista - RR,Activa,86,1/1/90,Roraima Energia S.A,Privado,Boa Vista,Roraima Energia S.A,werid coordinates,,-2.494398,-60.424289,86,Diesel
Brasil,Cristiano Rocha,Fuel oil,,Manaus - AM,Activa,85,16/11/2006,Rio Amazonas Energia S/A,Privado,Manaus,Rio Amazonas Energia S/A,werid coordinates,,-2.5333,-60.2,85,Fuel oil
Brasil,Refinaria Henrique Lages (REVAP),Otro,,São José dos Campos - SP,Activa,76,20/03/1980,Petróleo Brasileiro S A Petrobras,Mixto,Rio de Janeiro,Petróleo Brasileiro S A Petrobras,werid coordinates,,-23.1163,-45.49424,76,Gas
Brasil,Jaraqui,Gas natural,,Manaus - AM,Activa,75,5/4/06,Breitener Jaraqui S.A,Mixto,Manaus,Breitener Jaraqui S.A,werid coordinates,,-2.598,-60.138,75,Gas
Brasil,Alumar,Carbón,,São Luís - MA,Activa,75,20/10/2009,Consórcio De Alumínio Do Maranhão Consórcio Alumar,Privado,São Luis,Consórcio De Alumínio Do Maranhão Consórcio Alumar,werid coordinates,,-2.42243,-44.2136,75,Carbón
Brasil,Copesul,Petróleo,,Triunfo - RS,Activa,74,1/3/99,Braskem S/A,Privado,São Paulo,Braskem S/A,werid coordinates,,-29.56348,-51.4348,74,Otro
Brasil,REFAP,Fuel oil,,Canoas - RS,Activa,72,7/7/09,Petróleo Brasileiro S A Petrobras,Mixto,Rio de Janeiro,Petróleo Brasileiro S A Petrobras,werid coordinates,,-29.557309,-51.105171,72,Fuel oil
Brasil,Manauara,Gas natural,,Manaus - AM,Activa,68,22/9/2006,Companhia Energética Manauara,Privado,Manaus,Companhia Energética Manauara,werid coordinates,,-2.56273,-60.1187,68,Gas
Brasil,Potiguar III,Diesel,,Macaíba - RN,Activa,66,3/3/09,Companhia Energética Potiguar S.A.,Privado,Macaíba,Companhia Energética Potiguar S.A.,werid coordinates,,-5.522208,-35.3126969,66,Diesel
Brasil,Ponta Negra,Gas natural,,Manaus - AM,Activa,66,15/12/2006,Gera Amazonas Geradora De Energia Do Amazonas S.A.,Privado,Manaus,Gera Amazonas Geradora De Energia Do Amazonas S.A.,werid coordinates,,-3.536,-60.426,66,Gas
Brasil,Refinaria Duque de Caxias - REDUC,Gas natural,,Duque de Caxias - RJ,Activa,63,1/1/76,Petróleo Brasileiro S A Petrobras,Mixto,Rio de Janeiro,Petróleo Brasileiro S A Petrobras,werid coordinates,,-22.4252,-43.165002,63,Gas
Brasil,Refinaria Landulpho Alves (RLAM),Otro,,São Francisco do Conde - BA,Activa,63,8/1/01,Petróleo Brasileiro S A Petrobras,Mixto,Rio de Janeiro,Petróleo Brasileiro S A Petrobras,werid coordinates,,-12.37408,-38.4048,63,Gas
Brasil,Gabriel Passos,Petróleo,,Betim - MG,Activa,57,11/1/03,Petróleo Brasileiro S A Petrobras,Mixto,Rio de Janeiro,Petróleo Brasileiro S A Petrobras,werid coordinates,,-19.575862,-44.54388,57,Otro
Brasil,Parnaíba IV,Gas natural,,Santo Antônio dos Lopes - MA,Activa,56,13/12/2013,Parnaíba Ii Geração De Energia S.A,Privado,Rio de Janeiro,Parnaíba Ii Geração De Energia S.A,werid coordinates,,-4.4952,-44.21112,56,Gas
Brasil,Xavantes Aruanã,Diesel,,Goiânia - GO,Activa,54,17/07/2002,Usina Xavantes S.A.,Privado,Goiânia,Usina Xavantes S.A.,werid coordinates,,-16.3454,-49.1527,54,Diesel
Brasil,Potiguar,Diesel,,Macaíba - RN,Activa,53,3/3/09,Companhia Energética Potiguar S.A.,Privado,Macaíba,Companhia Energética Potiguar S.A.,werid coordinates,,-5.52286,-35.181,53,Diesel
Brasil,Refinaria Presidente Getúlio Vargas (REPAR),Otro,,Araucária - PR,Activa,52,1/1/76,Petróleo Brasileiro S A Petrobras,Mixto,Rio de Janeiro,Petróleo Brasileiro S A Petrobras,werid coordinates,,-25.342,-49.22,52,Gas
Brasil,Mauá Parte III Bloco Iranduba,Diesel,,Iranduba - AM,Activa,50,16/11/2010,Amazonas Geração E Transmissão De Energia S.A,Privado,Cachoeirinha,Amazonas Geração E Transmissão De Energia S.A,werid coordinates,,-3.542396,-60.284944,50,Diesel
México,CT Francisco Pérez Ríos,Fuel oil,Gas natural y vapor,"Tula, Hidalgo",Activa,1500,1975,,,Ciudad de México,,,,20.0554777,-99.277332,"1,500.00",Fuel oil
México,CT Punta Prieta II,Fuel oil,,"La Paz, Baja California Sur",Activa,113,1979,Comisión Federal de Electricidad (CFE),Estatal,Ciudad de México,100% estatal,,,24.223015,-110.30934,113,Fuel oil
México,Central de Combustión Interna Baja California Sur,Fuel oil,Diesel,"La Paz, Baja California Sur",Activa,121,2005,Comisión Federal de Electricidad (CFE),Estatal,Ciudad de México,100% estatal,,,24.1980433,-110.25651,121,Fuel oil
México,CT Benito Juárez,Fuel oil,Vapor,"Ciudad Juárez, Chihuahua",Activa,316,1985,Comisión Federal de Electricidad (CFE),Estatal,Ciudad de México,100% estatal,,,31.3313887,-106.48597,316,Vapor
México,CT Adolfo López Mateos,Fuel oil,,"Tuxpan, Veracruz",Activa,2100,1991,Comisión Federal de Electricidad (CFE),Estatal,Ciudad de México,100% estatal,,,21.0142495,-97.333803,"2,100.00",Fuel oil
México,CT General Manuel Álvarez Moreno,Fuel oil,Gas natural y vapor,"Manzanillo, Colima",Activa,2754,1982,Comisión Federal de Electricidad (CFE),Estatal,Ciudad de México,100% estatal,,,19.02717,-104.3198,"2,754.00",Fuel oil
México,CT Salamanca,Fuel oil,Gas natural,"Salamanca, Guanajuato",Activa,866,1971,Comisión Federal de Electricidad (CFE),Estatal,Ciudad de México,100% estatal,,,20.5689926,-101.17026,866,Fuel oil
México,CT Altamira,Fuel oil,Gas natural,"Altamira, Tamaulipas",Activa,800,1976,Comisión Federal de Electricidad (CFE),Estatal,Ciudad de México,100% estatal,,,22.4345136,-98.008003,800,Fuel oil
México,CT Manzanillo II,Fuel oil,Gas natural y vapor,"Manzanillo, Colima",Activa,700,1989,Comisión Federal de Electricidad (CFE),Estatal,Ciudad de México,100% estatal,falls into Laos,,19.0245734,-104.320228,700,Fuel oil
México,CT Carlos Rodríguez Rivero,Fuel oil,,"Guaymas, Sonora",Cerrada,484,1973,Comisión Federal de Electricidad (CFE),Estatal,Ciudad de México,100% estatal,,,27.9367777,-110.8628,484,Fuel oil
México,CT José Aceves Pozos,Fuel oil,,"Mazatlán, Sinaloa",Activa,616,1976,Comisión Federal de Electricidad (CFE),Estatal,Ciudad de México,100% estatal,,,23.1893636,-106.35598,616,Fuel oil
México,CT Lerma,Fuel oil,,"Campeche, Campeche",Activa,150,1976,Comisión Federal de Electricidad (CFE),Estatal,Ciudad de México,100% estatal,,,19.7951332,-90.613089,150,Fuel oil
México,CT Mérida II,Fuel oil,,"Mérida, Yucatán",Activa,168,1981,Comisión Federal de Electricidad (CFE),Estatal,Ciudad de México,100% estatal,,,20.927031,-89.6879518,168,Fuel oil
México,CT Puerto Libertad,Fuel oil,Gas natural,"Pitiquito, Sonora",Activa,632,1985,Comisión Federal de Electricidad (CFE),Estatal,Ciudad de México,100% estatal,,,29.9057967,-112.69282,632,Fuel oil
México,CT Guadalupe Victoria,Fuel oil,Vapor,"Lerdo, Durango",Activa,320,1991,Comisión Federal de Electricidad (CFE),Estatal,Ciudad de México,100% estatal,,,25.4929458,-103.57043,320,Fuel oil
México,CT Presidente Plutarco Elías Calles,Carbón,Petróleo,"Petacalco, Guerrero",Activa,2100,1993,Comisión Federal de Electricidad (CFE),Estatal,Ciudad de México,100% estatal,,,17.98257,-102.11603,"2,100",Carbón
México,CT Carbón II,Carbón,,"Nava, Coahuila",Activa,1400,1993,Comisión Federal de Electricidad (CFE),Estatal,Ciudad de México,100% estatal,,,28.4675,-100.69779,"1,400",Carbón
México,CT José López Portillo,Carbón,,"Nava, Coahuila",Activa,1200,1982,Comisión Federal de Electricidad (CFE),Estatal,Ciudad de México,100% estatal,,,28.48619,-100.69278,"1,200",Carbón
México,CCC Agua Prieta II,Gas natural,Solar y vapor,"Agua Prieta, Sonora",Activa,409,2016,Comisión Federal de Electricidad (CFE),Estatal,Ciudad de México,100% estatal,,https://www.elecnor.com/proyectos/central-de-ciclo-combinado-agua-prieta-mexico,31.2627917,-109.59189,409,Gas
México,CCC Norte III,Gas natural,,"Ciudad Juárez, Chihuahua",Activa,907,2020,"Macquarie Group Limited, Techint Ingeniería y Construcción e InfraRed Capital Partners Limited",Privado,Ciudad de México,,,https://www.proyectosmexico.gob.mx/proyecto_inversion/222-ciclo-combinado-norte-iii-juarez/,31.4729528,-106.47125,907,Gas
México,CCC Noroeste,Gas natural,,"Ahome, Sinaloa",Activa,911,2019,Iberdrola,Privado,Ciudad de México,,,https://www.iberdrolageneracionmexico.com/ciclo-combinado-topolobampo-ii/,25.9731404,-108.99138,911,Gas
México,CCC Noreste,Gas natural,,"Escobedo, Nuevo León",Activa,857,2019,Iberdrola,Privado,Ciudad de México,,,https://www.proyectosmexico.gob.mx/proyecto_inversion/220-planta-de-ciclo-combinado-noreste/,25.8698817,-100.36015,857,Gas
México,CCC Topolobampo III,Gas natural,,"Ahome, Sinaloa",En construcción,779,,Iberdrola,Privado,Ciudad de México,,,https://www.iberdrolageneracionmexico.com/ciclo-combinado-topolobampo-iii/,25.9723206,-108.99591,779,Gas
México,CCC Baja California III,Gas natural,,"Ensenada, Baja California",Activa,324,2017,Iberdrola,Privado,Ciudad de México,,,https://www.iberdrola.com/conocenos/lineas-negocio/proyectos-emblematicos/central-ciclo-combinado-baja-california-iii,31.9923082,-116.85189,324,Gas
México,CCC Dulces Nombres II,Gas natural,,"Monterrey, Nuevo León",Activa,303,2016,Iberdrola,Privado,Ciudad de México,,,https://www.iberdrolageneracionmexico.com/ciclo-combinado-dulces-nombres-ii/,25.7174407,-100.09819,303,Gas
México,CCC Dulces Nombres,Gas natural,,"Monterrey, Nuevo León",Activa,962,2002,Iberdrola,Privado,Ciudad de México,,,,25.7189497,-100.0963,962,Gas
México,CCC El Carmen,Gas natural,,"El Carmen, Nuevo León",Activa,866,2019,Iberdrola,Privado,Ciudad de México,,,https://www.iberdrolamexico.com/entra-en-operacion-la-primera-central-de-iberdrola-mexico-destinada-a-vender-a-clientes-industriales-en-el-mercado-electrico-mayorista/,25.8638889,-100.36778,866,Gas
México,CCC La Laguna II,Gas natural,,"Durango, Durango",Activa,538,2005,Iberdrola,Privado,Ciudad de México,,,,25.601,-103.468,538,Gas
México,CCC Altamira III y IV,Gas natural,,"Altamira, Tamaulipas",Activa,1036,2003,Iberdrola,Privado,Ciudad de México,,,https://www.iberdrolageneracionmexico.com/wp-content/uploads/mapa/index.php,22.4940217,-97.90168,"1,036",Gas
México,CCC Altamira V,Gas natural,,"Altamira, Tamaulipas",Activa,1093,2006,Iberdrola,Privado,Ciudad de México,,,,22.5000286,-97.905951,"1,093",Gas
México,CCC Tamazunchale,Gas natural,,"Tamazunchale, San Luis Potosí",Activa,1179,2007,Iberdrola,Privado,Ciudad de México,,,https://www.iberdrolageneracionmexico.com/ciclo-combinado-tamazunchale/,21.2580214,-98.786488,"1,179",Gas
México,CCC San Luis de la Paz,Gas natural,,"San Luis de la Paz, Guanajuato",Activa,220,2016,Saavi Energía,Privado,Ciudad de México,,,https://www.saavienergia.com/inicio,21.2449824,-100.61043,220,Gas
México,CCC Chihuahua III,Gas natural,,"Chihuahua, Chihuahua",Activa,271,2003,Saavi Energía,Privado,Ciudad de México,,,,31.3325984,-106.48859,271,Gas
México,CCC Termoeléctrica de Mexicali,Gas natural,,"Mexicali, Baja California",Activa,625,2003,Termoeléctrica de Mexicali,Privado,Ciudad de México,,,https://termoelectricamexicali.com/,32.6004631,-115.66236,625,Gas
México,CCC La Rosita,Gas natural,,"Mexicali, Baja California",Activa,1065,2003,Saavi Energía,Privado,Ciudad de México,,,,32.5988186,-115.6287,"1,065",Gas
México,CCC Campeche,Gas natural,,"Palizada, Campeche",Activa,225,2003,Saavi Energía,Privado,Ciudad de México,,,,17.939615,-91.733137,225,Gas
México,CCC El Sauz,Gas natural,,"Pedro Escobedo, Querétaro",Activa,591,1981,Comisión Federal de Electricidad (CFE),Estatal,Ciudad de México,100% estatal,,https://www.gob.mx/presidencia/articulos/version-estenografica-visita-tecnica-a-la-central-ciclo-combinado-el-sauz?idiom=es,20.4572126,-100.1205,591,Gas
México,CCC Norte,Gas natural,Vapor,"Durango, Durango",Activa,450,2010,Naturgy,Privado,Ciudad de México,,,https://globalpowergeneration-int.azurewebsites.net/es/proyectos/mexico/,24.222515,-104.48198,450,Gas
México,CCC San Lorenzo,Gas natural,,"Cuautlancingo, Puebla",Activa,455,2009,Comisión Federal de Electricidad (CFE),Estatal,Ciudad de México,100% estatal,,,19.1205186,-98.246286,455,Gas
